{
  "confidence": "low",
  "evidence": [
    {
      "date": "2026-10-11",
      "id": "WDM-EMPTY-01",
      "procedure": "research/raw-observations/WDM-EMPTY-01.json; Fresh preparation screen entered through the visible game start button.; Serve highlighted; preparation screen remained visible; no score or reaction displayed.",
      "referenceBuild": "wdm-rightmix-2013-observable-20261011",
      "repetitions": 1,
      "scope": "reference-automated",
      "source": "https://www.webdesignmuseum.org/flash-games/the-right-mix-in-2013"
    }
  ],
  "id": "case-WDM-EMPTY-01",
  "inputSequence": [],
  "inputValidation": {
    "evidenceIds": [],
    "notes": "INCOMPLETE INPUT: empty history means unmapped/unknown, not an empty reference cocktail. Never score this projection.",
    "status": "UNVERIFIED"
  },
  "notes": "No calibrated reference pour quantum; no ml mapping. DOM delivery or requested hold time is not Flash-effective duration or tick count. Input reliability unresolved: no numerical score obtained. Empty canonical history means UNKNOWN input, not zero ingredients. Reset was not visible/available; repeats used the same empty session, not verified Reset. Raw source: research/raw-observations/WDM-EMPTY-01.json",
  "observedReferenceResult": {
    "phase": "preparation-screen"
  },
  "origin": "REFERENCE",
  "purpose": "Black-box observation; original raw data remain authoritative.",
  "schemaVersion": 1,
  "status": "UNVERIFIED",
  "title": "E01-empty-serve / WDM-EMPTY-01"
}
