{
  "confidence": "low",
  "evidence": [
    {
      "date": "2026-10-11",
      "id": "WDM-PLAYER-DIAG-01",
      "procedure": "research/raw-observations/WDM-PLAYER-DIAG-01.json; Continuation of the preceding diagnostic attempt; not a controlled fresh cocktail.; Public Ruffle Play returned to the introduction; re-entered preparation. Pour and Serve did not yield score.",
      "referenceBuild": "wdm-rightmix-2013-observable-20261011",
      "repetitions": 1,
      "scope": "reference-automated",
      "source": "https://www.webdesignmuseum.org/flash-games/the-right-mix-in-2013"
    }
  ],
  "id": "case-WDM-PLAYER-DIAG-01",
  "inputSequence": [],
  "inputValidation": {
    "evidenceIds": [],
    "notes": "INCOMPLETE INPUT: empty history means unmapped/unknown, not an empty reference cocktail. Never score this projection.",
    "status": "UNVERIFIED"
  },
  "notes": "No calibrated reference pour quantum; no ml mapping. DOM delivery or requested hold time is not Flash-effective duration or tick count. Input reliability unresolved: no numerical score obtained. Empty canonical history means UNKNOWN input, not zero ingredients. Ruffle context-menu Play is a player control, not reference Reset; it must never become a Reset domain event. Raw source: research/raw-observations/WDM-PLAYER-DIAG-01.json",
  "observedReferenceResult": {
    "phase": "preparation-screen"
  },
  "origin": "REFERENCE",
  "purpose": "Black-box observation; original raw data remain authoritative.",
  "schemaVersion": 1,
  "status": "UNVERIFIED",
  "title": "player-calibration / WDM-PLAYER-DIAG-01"
}
