{
  "confidence": "low",
  "evidence": [
    {
      "date": "2026-10-11",
      "id": "IA-SYNTH-MOUSE-01",
      "procedure": "research/raw-observations/IA-SYNTH-MOUSE-01.json; Fresh wrapper with asynchronous MouseEvent buttons; game started and bottle selected.; Bottle held upright; synthetic MouseEvents received by wrapper but no established liquid quantity or score.",
      "referenceBuild": "ia-therightmix-ede221ad99e03173",
      "repetitions": 1,
      "scope": "reference-automated",
      "source": "https://archive.org/details/flash_therightmix"
    }
  ],
  "id": "case-IA-SYNTH-MOUSE-01",
  "inputSequence": [],
  "inputValidation": {
    "evidenceIds": [],
    "notes": "INCOMPLETE INPUT: empty history means unmapped/unknown, not an empty reference cocktail. Never score this projection.",
    "status": "UNVERIFIED"
  },
  "notes": "No calibrated reference pour quantum; no ml mapping. DOM delivery or requested hold time is not Flash-effective duration or tick count. Input reliability unresolved: no numerical score obtained. Empty canonical history means UNKNOWN input, not zero ingredients. Synthetic interval 1010 ms. A received untrusted DOM event does not prove acceptance by Flash. Raw source: research/raw-observations/IA-SYNTH-MOUSE-01.json",
  "observedReferenceResult": {
    "phase": "preparation-screen"
  },
  "origin": "REFERENCE",
  "purpose": "Black-box observation; original raw data remain authoritative.",
  "schemaVersion": 1,
  "status": "UNVERIFIED",
  "title": "asynchronous-mouse-diagnostic / IA-SYNTH-MOUSE-01"
}
