{
  "confidence": "low",
  "evidence": [
    {
      "date": "2026-10-11",
      "id": "IA-CHROME-DIAG-02",
      "procedure": "research/raw-observations/IA-CHROME-DIAG-02.json; Continuation of the preceding diagnostic attempt; not a controlled fresh cocktail.; STOP and tilted bottle visible immediately after the hold; a later snapshot showed upright bottle / Pour. No score.",
      "referenceBuild": "ia-therightmix-ede221ad99e03173",
      "repetitions": 1,
      "scope": "reference-automated",
      "source": "https://archive.org/details/flash_therightmix"
    }
  ],
  "id": "case-IA-CHROME-DIAG-02",
  "inputSequence": [],
  "inputValidation": {
    "evidenceIds": [],
    "notes": "INCOMPLETE INPUT: empty history means unmapped/unknown, not an empty reference cocktail. Never score this projection.",
    "status": "UNVERIFIED"
  },
  "notes": "No calibrated reference pour quantum; no ml mapping. DOM delivery or requested hold time is not Flash-effective duration or tick count. Input reliability unresolved: no numerical score obtained. Empty canonical history means UNKNOWN input, not zero ingredients. Same continued session, not a repeat with known equal quantity. No exact delivery trace was captured for this hold. Raw source: research/raw-observations/IA-CHROME-DIAG-02.json",
  "observedReferenceResult": {
    "phase": "pour-control-stop-visible"
  },
  "origin": "REFERENCE",
  "purpose": "Black-box observation; original raw data remain authoritative.",
  "schemaVersion": 1,
  "status": "UNVERIFIED",
  "title": "pour-repeat-diagnostic / IA-CHROME-DIAG-02"
}
